{
  "schemaVersion": "ruleoak.governance.v1",
  "recordType": "ApprovalRecord",
  "approvalId": "conformance-approval-001",
  "runId": "conformance-run-001",
  "action": "write.production_change",
  "subject": "service://checkout/threshold",
  "decision": "approved",
  "actor": "human-reviewer",
  "reason": "Evidence and rollback plan are present.",
  "metadata": {
    "ticket": "CONF-1"
  },
  "createdAt": "2026-01-01T00:00:00.000Z"
}
